{
  "name": "local-apt-smoke",
  "description": "Disposable local Pulp session that syncs a deterministic apt fixture repository, publishes it, and validates client consumption with apt-get.",
  "pulp": {
    "repositoryName": "local-apt-smoke-repo",
    "remoteName": "local-apt-smoke-remote",
    "publicationName": "local-apt-smoke-publication",
    "distributionName": "local-apt-smoke-dist",
    "requiredPlugins": ["pulp_deb"]
  },
  "fixture": {
    "package": "pulp-smoke",
    "version": "0.1.0",
    "architecture": "amd64",
    "summary": "Disposable package generated by the local Pulp harness."
  },
  "apt": {
    "distribution": "stable",
    "component": "main",
    "basePath": "apt/local-smoke",
    "trusted": true
  },
  "evidence": {
    "directory": "evidence"
  }
}